batch,question_number,question_id,skill_id,question_stem,A,B,C,D,E,F,correct_answer,explanation,audit_flag,changes_applied
4,10,PQ_ACA-07_10,ACA-07,A student demonstrates age-appropriate decoding skills and vocabulary but frequently has difficulty retelling or answering questions about stories read to him. His working memory score is below average. Which best explains this pattern?,Poor phonemic awareness limits decoding development,Weak working memory constrains the ability to hold and manipulate information during listening comprehension,"Vocabulary deficits reduce comprehension, without adequate clinical justification.","Inadequate phonics instruction in early grades, without adequate clinical justification.",,,B,"Listening comprehension depends on the ability to hold information in working memory while processing meaning. This student's below-average working memory directly explains difficulty with story comprehension and retelling despite adequate decoding and vocabulary. Phonemic awareness and phonics are adequate (evidenced by decoding skills). Vocabulary is age-appropriate. Working memory limitations, not instruction history, explain the current pattern.",,DISTRACTOR_C_EXPANDED; DISTRACTOR_D_EXPANDED
4,11,PQ_ACA-07_11,ACA-07,"Morphological awareness—the understanding that words have meaningful parts (roots, prefixes, suffixes)—is most critical for which aspect of reading development?",Phonemic awareness and decoding of single-syllable words,Vocabulary expansion and reading fluency with multisyllabic words,Phonological processing of rhyming patterns,Pragmatic language use in conversation,,,B,"Morphological awareness is essential for understanding word meanings and decoding longer, multisyllabic words by breaking them into meaningful parts (e.g., ""unhappily"" = un- + happy + -ly). This directly supports vocabulary growth and fluency with complex words. It is not a phonemic awareness skill (Option A) or related to rhyming (Option C) or social language use (Option D).",,
4,12,PQ_ACA-07_12,ACA-07,A preschool teacher is concerned that a 4-year-old does not produce many multi-word utterances and uses mostly single words. The child has age-appropriate motor skills and hearing is normal. What is the most appropriate initial action for a school psychologist?,Immediately refer for special education evaluation under the speech/language disability category,Conduct a comprehensive language screener to assess expressive and receptive language; compare to age norms,Recommend the child is not ready for kindergarten and needs another year of preschool,Advise the teacher that this is within normal variation and no further assessment is needed,,,B,"The appropriate first step is to administer a comprehensive language screener to assess both expressive (production) and receptive (understanding) language compared to age-normed expectations. At age 4, most children are combining words, but there is variation. Screening determines if a deficit exists before formal evaluation. A referral for special education without screening data (Option A) is premature. Retention decisions (Option C) are not appropriate based on language alone. Dismissing concerns without assessment (Option D) ignores the teacher's valid observation.",,
4,13,PQ_ACA-07_13,ACA-07,Which statement best describes the relationship between oral language development and reading readiness?,Oral language and reading develop independently; strong oral language does not necessarily predict reading success,Oral language provides the foundation for reading; children with stronger oral language skills typically develop reading skills more easily,Reading ability is primarily determined by phonics instruction; oral language is a minor factor,Oral language is important only for students learning English as a second language,,,B,"Strong empirical evidence shows that oral language (vocabulary, syntax, narrative ability) is foundational for reading comprehension. Oral language provides the semantic and syntactic base upon which reading comprehension is built. Option A contradicts research evidence. Option C underestimates the importance of oral language. Option D incorrectly limits the relevance of oral language to only English language learners.",,
4,14,PQ_ACA-07_14,ACA-07,"A kindergarten student can rhyme words, identify that ""cat"" and ""can"" start with the same sound, and clap syllables in words. These skills represent which component of early literacy?",Phonics and letter-sound correspondence,Phonological awareness (awareness of sound structures),Phonemic awareness (manipulation of individual phonemes),Alphabetic principle understanding,,,B,"Rhyming, initial sound awareness, and syllable clapping are all phonological awareness skills—the broader category of sound structure awareness. These are NOT yet phonemic awareness (individual phoneme manipulation like deleting sounds), phonics (letter-sound correspondence), or the alphabetic principle (letters = sounds). Phonological awareness is a prerequisite for these more advanced skills.",,
4,15,PQ_ACA-07_15,ACA-07,"A second-grade intervention group is using explicit, systematic instruction in decoding using a structured sequence: consonants, short vowels, blending, CVC words, then consonant blends. This approach reflects which literacy framework?","Whole language, emphasizing authentic literature and meaning-making",Balanced literacy with a mix of guided reading and independent reading,"Structured literacy with explicit, sequential, multisensory phonics instruction",Embedded literacy within content areas like science and social studies,,,C,"The carefully sequenced, explicit phonics progression (consonants → short vowels → blending → CVC → blends) is the hallmark of structured literacy. This is the evidence-based approach for struggling readers and those with dyslexia. Whole language (Option A) does not involve this level of explicit, sequential structure. Balanced literacy (Option B) combines approaches but does not necessarily include this systematic phonics sequence. Embedded literacy (Option D) integrates reading within content; this is explicit phonics instruction.",,
4,16,PQ_ACA-07_16,ACA-07,"A third-grader reads accurately and fluently but rarely comprehends what he reads. His teacher notes he seems to be ""barking at print"" without understanding. Which statement best characterizes this profile?",Decoding is strong; language comprehension is weak,This pattern indicates dyslexia despite accurate decoding,Working memory deficits are the primary cause,Fluency problems are interfering with comprehension,,,A,"This is the inverse pattern of the Simple View of Reading: strong decoding but weak comprehension indicates language comprehension is the limiting factor. ""Barking at print"" is the classic description of this profile. Dyslexia involves decoding difficulties, not this pattern (Option B). While working memory could contribute (Option C), the primary issue based on the profile is comprehension strategies and oral language. Fluency is adequate (Option D), so that's not the constraint.",,CORRECT_A_SHORTENED(em-dash trim)
4,17,PQ_ACA-07_17,ACA-07,Which of the following is the most accurate description of pragmatic language skills and their relationship to literacy?,Pragmatic language is the ability to decode words and has no relationship to reading comprehension,Pragmatic language is understanding social language rules and conventions,Pragmatic language only develops after reading fluency is established,Pragmatic language deficits are the primary cause of dyslexia,,,B,"Pragmatic language—the ability to understand and use language appropriately in social and communicative contexts—supports comprehension of dialogue, inference about characters' intentions, and discussion of text. It is not the same as decoding (Option A). It develops concurrently with other language skills, not after fluency (Option C). Pragmatic deficits are not a cause of dyslexia (Option D), though they may co-occur with language disorders.",,CORRECT_B_SHORTENED(semicolon trim)
4,18,PQ_ACA-07_18,ACA-07,"In an MTSS (Multi-Tiered System of Supports) reading framework, Tier 1 represents universal screening and core instruction for all students. What is the primary goal of Tier 2 interventions?",Provide specialized literacy instruction for students with learning disabilities requiring special education,"Provide targeted, small-group interventions for students not responding to Tier 1 instruction",Deliver classroom-wide reading instruction to all students,Assess students for special education eligibility,,,B,"Tier 2 in MTSS provides targeted interventions for the 15-20% of students not responding adequately to Tier 1 core instruction. These are evidence-based small-group interventions delivered with increased frequency/intensity. Tier 3 (Option A) involves specialized, intensive interventions and special education evaluation. Tier 1 (Option C) is universal instruction. Option D describes evaluation, which occurs across tiers but is not the primary goal of Tier 2.",,
4,19,PQ_ACA-07_19,ACA-07,"A kindergarten student shows emerging phonological awareness (rhyming, syllable awareness) but has minimal exposure to alphabet letters and print concepts. Which foundational skill should be prioritized in instruction?",Phonemic awareness training (individual phoneme manipulation),Letter recognition and print concepts (alphabet knowledge),Phonics instruction and sound-symbol correspondence,Advanced reading fluency and comprehension strategies,,,B,"Before phonemic awareness (Option A) or phonics instruction (Option C) can be effective, students need basic alphabet knowledge and print concept awareness. This foundational knowledge includes letter recognition, directionality, and understanding that print conveys meaning. The progression is: print awareness → letter knowledge → phonological awareness → phonemic awareness → phonics. Phonemic awareness (Option A) typically follows letter introduction. Phonics (Option C) and fluency/comprehension (Option D) come later in the progression.",,
4,20,PQ_ACA-07_20,ACA-07,A student with adequate decoding and vocabulary shows comprehension difficulty specifically with complex sentence structures and inferential questions. Which language component is most likely weak?,Syntactic awareness and semantic processing of complex language,Phonemic awareness and phonics,Oral fluency and speaking rate,Phonological memory and working memory only,,,A,"Difficulty with complex sentence structures and inferential comprehension indicates weakness in syntactic awareness (understanding sentence grammar) and semantic processing (deriving meaning from language structures). Phonemic awareness and phonics are not the issue (adequate decoding). Oral fluency/speaking rate (Option C) and phonological memory alone (Option D) do not fully explain this pattern; syntactic/semantic processing is the core deficit.

---",,
