batch,question_number,question_id,skill_id,question_stem,A,B,C,D,E,F,correct_answer,explanation,audit_flag,changes_applied
4,14,PQ_ACA-04_14,ACA-04,Spaced practice (spacing learning sessions) is superior to massed practice (all at once) for:,Immediate test performance on the following day.,Short-term cramming the night before an exam.,Long-term retention and transfer of learning.,Reducing student effort and study time.,,,C,"Research shows spaced practice produces better long-term learning and transfer than massed practice, though massed practice may feel more immediately effective. Options A and B describe massed practice's short-term effects. Option D is not an advantage but a misconception.",,
4,15,PQ_ACA-04_15,ACA-04,Interleaving (mixing different types of problems or topics during practice) compared to blocked practice (practicing one type at a time):,Is easier for students in the short term.,Produces better long-term retention and ability to distinguish between problem types.,Should be avoided for struggling learners.,Reduces cognitive load.,,,B,Interleaving improves discrimination and transfer by requiring students to distinguish and apply different problem types. Option A—interleaving is harder initially but beneficial long-term. Option C—interleaving benefits diverse learners. Option D—interleaving increases cognitive demand (beneficial for learning).,,
4,16,PQ_ACA-04_16,ACA-04,Error correction in instruction should:,Be avoided to protect student self-esteem.,"Be immediate, clear, and specific; helping the student understand the correct approach.",Focus on criticism rather than correction.,Be done privately without peers aware.,,,B,"Immediate, specific error correction promotes learning; students understand the mistake and the correct approach. Option A ignores learning benefits of correction. Option C is harsh and unhelpful. Option D is not essential; respectful public correction can be effective.",,
4,17,PQ_ACA-04_17,ACA-04,Instructional feedback to students should:,Be given infrequently to avoid overwhelming students.,"Be specific, timely, and focused on effort and strategy.","Praise ability exclusively (""You're smart"").",Be delayed until the end of a unit.,,,B,"Effective feedback is specific (what to do differently), timely (soon after performance), and emphasizes effort/strategy over fixed ability. Option A—frequent feedback aids learning. Option C—ability feedback can undermine motivation. Option D—delayed feedback is less effective.",,
4,18,PQ_ACA-04_18,ACA-04,"Cooperative learning structures (e.g., jigsaw, think-pair-share) are effective because they:",Require less teacher preparation.,"Promote active engagement, peer learning, and accountability.",Are appropriate only for advanced students.,Eliminate the need for whole-class instruction.,,,B,Cooperative structures increase engagement and peer support while maintaining individual accountability. Option A may be false. Option C—structures benefit diverse learners. Option D—whole-class instruction serves important functions.,,
4,19,PQ_ACA-04_19,ACA-04,Zone of proximal development (Vygotsky) in instruction suggests:,Students should work entirely independently without support.,Instruction should occur in the gap between what the student can do independently and what the student can do with support.,All students at the same grade level have identical ZPDs.,Support should never be withdrawn.,,,B,The ZPD is the learning sweet spot where support optimizes growth. Instruction targets this zone through scaffolding. Option A eliminates necessary support. Option C ignores individual differences. Option D—support should be gradually withdrawn as competence grows.,STILL_FLAGGED|margin=63,
4,20,PQ_ACA-04_20,ACA-04,An evidence-based instructional plan should include:,The teacher's preferred teaching method regardless of student need.,"Assessment of student readiness, selection of evidence-based strategies matched to need, implementation with fidelity, and progress monitoring.","The same strategy for all students in the class, without adequate clinical justification.","Instruction without ongoing evaluation, without adequate clinical justification.",,,B,"Evidence-based practice involves assessing need, selecting appropriate interventions, implementing with fidelity, and monitoring progress. Option A ignores student data. Option C ignores individual differences. Option D omits essential evaluation.

---",PARTIAL_FIX|margin=54,DISTRACTOR_C_EXPANDED; DISTRACTOR_D_EXPANDED
4,1,PQ_ACA-06_1,ACA-06,"According to Pavlov's classical conditioning, pairing a neutral stimulus (bell) with an unconditioned stimulus (food) repeatedly will result in:",The neutral stimulus eventually eliciting the response (salivation) previously elicited only by food.,The conditioned stimulus no longer eliciting a response.,Immediate extinction of the response.,The food no longer being reinforcing.,,,A,"Through repeated pairings, the neutral stimulus becomes a conditioned stimulus, eliciting the conditioned response. Option B describes extinction. Option C is not immediate. Option D contradicts the principle.",,
4,2,PQ_ACA-06_2,ACA-06,Positive reinforcement in Skinner's operant conditioning means:,Punishing unwanted behavior.,Adding a desirable consequence after a behavior to increase the likelihood of repetition.,Removing an aversive stimulus.,Praising students regardless of behavior.,,,B,"Positive reinforcement adds a desirable consequence (e.g., praise, tokens) following desired behavior to increase repetition. Option A describes punishment. Option C describes negative reinforcement. Option D is indiscriminate praise, not contingent reinforcement.",,
4,3,PQ_ACA-06_3,ACA-06,A teacher provides praise (a reinforcer) every single time a student raises their hand to answer questions. This is an example of:,Variable interval schedule.,Continuous reinforcement schedule.,Fixed ratio schedule.,Extinction.,,,B,Continuous reinforcement means every instance of the behavior is reinforced. Option A provides reinforcement after varying time intervals. Option C provides reinforcement after a fixed number of responses. Option D is removal of reinforcement.,,
4,4,PQ_ACA-06_4,ACA-06,"A variable ratio reinforcement schedule (e.g., reinforcing on average every 5th correct response, but unpredictably) produces:",Rapid extinction of the behavior.,The behavior most resistant to extinction.,Temporary learning only.,Decreased motivation for the behavior.,,,B,"Variable ratio schedules produce persistent, motivated behavior most resistant to extinction (like slot machines). Option A is opposite. Option C is false. Option D is opposite.",,
4,5,PQ_ACA-06_5,ACA-06,Cognitive-behavioral theory emphasizes:,"Only behavior change, without considering thoughts.","The reciprocal relationship between thoughts, feelings, and behavior.","Only thoughts and emotions, ignoring behavior.",Behavior as determined solely by the environment.,,,B,"Cognitive-behavioral theory recognizes that thoughts influence feelings/behavior and vice versa; change in any component can create overall change. Option A is behaviorist, not cognitive-behavioral. Option C ignores behavior. Option D is purely behaviorist.",,
4,6,PQ_ACA-06_6,ACA-06,Bandura's social learning theory emphasizes that learning occurs through:,"Direct experience only, which is not supported by the available evidence.",Observational learning (watching others) and the influence of self-efficacy on behavior.,"Innate, predetermined responses, without adequate clinical justification.","Punishment and reward exclusively, without adequate clinical justification.",,,B,"Social learning theory stresses observational learning, modeling, and self-efficacy beliefs. Option A ignores observational learning. Option C is not social learning theory. Option D is behavioral, not social learning.",,DISTRACTOR_A_EXPANDED; DISTRACTOR_C_EXPANDED; DISTRACTOR_D_EXPANDED
4,7,PQ_ACA-06_7,ACA-06,Vygotsky's zone of proximal development (ZPD) is the gap between:,"Current and future grades, which is not supported by the available evidence.",What the student can do independently and what the student can do with adult or expert support.,"Intelligence and achievement, which is not supported by the available evidence.","Grade level and chronological age, without adequate clinical justification.",,,B,The ZPD is the learning space between independent performance and performance possible with guidance—the optimal zone for learning. Option A is academic outcomes. Option C is ability-achievement discrepancy. Option D is age-grade alignment.,,DISTRACTOR_A_EXPANDED; DISTRACTOR_C_EXPANDED; DISTRACTOR_D_EXPANDED
4,8,PQ_ACA-06_8,ACA-06,Piaget's preoperational stage (approximately ages 2-7) is characterized by:,"Concrete, logical thinking about objects and events.","Egocentrism, centration, and lack of conservation.",Abstract reasoning and hypothetical thinking.,Sensorimotor reflexes and primitive adaptation.,,,B,"The preoperational stage involves egocentric (self-centered) thinking, centration on one feature, and difficulty with conservation concepts. Option A describes concrete operational. Option C describes formal operational. Option D describes sensorimotor.",,
4,9,PQ_ACA-06_9,ACA-06,A child in the concrete operational stage (Piaget) can:,Understand abstract mathematical concepts and hypothetical scenarios.,Reason logically about concrete objects and events; understand conservation.,Use only senses and motor reflexes to understand the world.,Engage in realistic play without understanding cause-effect.,,,B,"Concrete operational children (7-11) think logically about concrete, present experiences; they understand conservation and reversibility. Option A describes formal operational. Option C describes sensorimotor. Option D describes preoperational.",,
4,10,PQ_ACA-06_10,ACA-06,"In information processing theory, working memory capacity is limited and can typically hold:",Unlimited information.,One to two items.,Five to nine items (chunks).,More than 20 items.,,,C,Working memory holds approximately 5-9 chunks (units) of information. Option A is long-term memory. Option B underestimates. Option D overestimates capacity.,,
4,11,PQ_ACA-06_11,ACA-06,"Schema theory (Piaget, Bartlett) proposes that:",People have unlimited memory capacity for all information.,People organize knowledge into patterns/schemas,Memory is purely factual storage without organization.,Schemas are fixed and never change.,,,B,Schema theory explains how knowledge is organized into mental patterns and how new information is incorporated. Option A contradicts schema theory. Option C ignores organization. Option D contradicts the dynamic nature of schemas.,,CORRECT_B_SHORTENED(semicolon trim)
4,12,PQ_ACA-06_12,ACA-06,Cognitive load theory suggests that:,More information is always better for learning.,Learners have limited working memory capacity,Cognitive load is not a factor in learning.,Advanced learners have no cognitive load.,,,B,Cognitive load theory explains that working memory is limited; effective instruction manages extraneous load and optimizes relevant load. Option A ignores capacity limits. Option C contradicts the theory. Option D is false; advanced learners also have limits.,,CORRECT_B_SHORTENED(semicolon trim)
4,13,PQ_ACA-06_13,ACA-06,Transfer of learning refers to:,Moving a student to a different class.,"Applying knowledge or skills learned in one context to new, different contexts.",Forgetting previously learned information.,Moving physically from one location to another.,,,B,"Transfer is the ability to apply learning in new situations (e.g., applying math skills learned in class to real-world problems). Option A is classroom placement. Option C is forgetting. Option D is literal movement.",,
4,14,PQ_ACA-06_14,ACA-06,Constructivism in education emphasizes that:,Knowledge is passively received from teachers.,Students actively construct knowledge by integrating new information with prior experience.,All students construct identical knowledge.,Teachers should provide all answers without student exploration.,,,B,"Constructivism views learning as active construction, not passive reception. Students build understanding through experience and interaction. Option A is transmission model. Option C ignores individual differences. Option D is direct transmission.",,
4,15,PQ_ACA-06_15,ACA-06,Situated learning theory proposes that:,Learning occurs independent of context.,Learning is deeply connected to the context and activity in which it occurs,Context is irrelevant to educational outcomes.,Learning can only happen in classrooms.,,,B,"Situated learning emphasizes that knowledge is tied to its context; authentic, meaningful activities enhance learning. Option A contradicts the theory. Option C ignores context effects. Option D limits learning locations unnecessarily.",,CORRECT_B_SHORTENED(semicolon trim)
4,16,PQ_ACA-06_16,ACA-06,Intrinsic motivation (learning for internal satisfaction) is generally more sustainable and effective than extrinsic motivation (learning for external rewards) because:,Extrinsic motivation is never effective.,"Intrinsic motivation fosters deeper engagement, persistence, and continued learning after external rewards end.",All students are intrinsically motivated.,Internal motivation is irrelevant to learning.,,,B,"Intrinsic motivation produces more persistent, deep, autonomous learning. While extrinsic motivation can be useful initially, intrinsic motivation is more sustainable. Option A overstates. Option C ignores individual differences. Option D is false.",STILL_FLAGGED|margin=65,
4,17,PQ_ACA-06_17,ACA-06,"Attribution theory (Weiner) examines how people explain success and failure. A student who attributes failure to lack of effort (internal, controllable) is more likely to:",Give up trying next time.,Persist and try harder on future tasks.,Develop learned helplessness.,Become discouraged permanently.,,,B,"Attributing failure to controllable factors (effort) promotes persistence; the student believes trying harder will succeed. Options A, C, and D reflect uncontrollable attributions.",,
4,18,PQ_ACA-06_18,ACA-06,Dual coding theory (Paivio) suggests that:,Information is stored in only one code (visual or verbal).,Information encoded in both visual and verbal forms is better remembered than information in a single code.,Visual codes are always superior to verbal codes.,Dual coding reduces learning efficiency.,,,B,Dual coding theory explains that presenting information in both words and images enhances encoding and memory. Option A contradicts the theory. Options C and D are false.,,
4,19,PQ_ACA-06_19,ACA-06,"An instructor teaches students to solve a particular math problem type, then the students encounter a novel problem requiring the same strategy but with different numbers/context. Success demonstrates:",Rote memorization.,Transfer of learning—applying the learned strategy to a new situation.,Lack of understanding.,Context-dependent learning only.,,,B,Applying a strategy to a novel problem demonstrates positive transfer—using knowledge flexibly in new contexts. Option A is memorization without flexibility. Option C is opposite. Option D would indicate failure to transfer.,,
4,20,PQ_ACA-06_20,ACA-06,"Which theory would BEST explain why students who engage in active, hands-on science experiments learn more deeply than students who watch the teacher demonstrate?","Classical conditioning, which is not supported by the available evidence.","Operant conditioning exclusively, without adequate clinical justification.",Constructivism and cognitive load theory (hands-on experience builds meaningful understanding while managing cognitive demand).,"Schema theory exclusively, which is not supported by the available evidence.",,,C,Constructivism explains active construction of knowledge through experience. Cognitive load theory adds that hands-on activity can manage cognitive demand better than passive observation. Option A is classical conditioning (not relevant). Option B is only operant learning. Option D is incomplete without constructivism perspective.,PARTIAL_FIX|margin=51,DISTRACTOR_A_EXPANDED; DISTRACTOR_B_EXPANDED; DISTRACTOR_D_EXPANDED
4,1,PQ_ACA-07_1,ACA-07,"A 2-year-old produces ""mama,"" ""dada,"" and ""dog"" consistently in appropriate contexts but does not combine two words. Which language development milestone is this child demonstrating?",Two-word combinations (expected at 24-30 months),Single-word utterances with semantic meaning (expected at 12-18 months),Phonemic awareness development,Phonological process suppression,,,B,"This child is producing single-word utterances with semantic meaning, which is the expected milestone for 12-18 months of age. Two-word combinations typically emerge around 24-30 months, so the child is not yet at that stage. Phonemic awareness (consciously manipulating sounds) develops later, typically around ages 4-5. Phonological process suppression refers to the natural decline of immature sound patterns (like ""wabbit"" for ""rabbit""), which is a separate developmental trajectory.",,
4,2,PQ_ACA-07_2,ACA-07,Which of the following best describes the relationship between phonological awareness and phonemic awareness?,They are identical constructs and the terms can be used interchangeably,Phonological awareness is the broader construct; phonemic awareness is a subset focusing specifically on individual phonemes,Phonemic awareness develops before phonological awareness and is a prerequisite skill,Phonological awareness is auditory; phonemic awareness is visual and letter-based,,,B,"Phonological awareness is the umbrella construct encompassing awareness of all sound structures (rhyme, syllables, onset-rime, phonemes), while phonemic awareness specifically focuses on manipulating individual phonemes (the smallest sound units). They are not identical—phonemic awareness is a subset of phonological awareness, not synonymous. Phonemic awareness does not necessarily develop before broader phonological awareness; in fact, rhyme and syllable awareness typically precede phonemic awareness. Both are auditory in nature, not visual; phonics (not phonemic awareness) involves the letter-sound relationship.",,
4,3,PQ_ACA-07_3,ACA-07,"A second-grade student reads single-word decodable words accurately but struggles significantly with comprehension of grade-level passages. His listening comprehension is average. Based on the Simple View of Reading (Scarborough), what is the primary area of concern?",Language comprehension abilities are weak,Decoding (word recognition) is the limiting factor,Oral language development is delayed,Phonemic awareness is insufficiently developed,,,B,"The Simple View of Reading states that reading comprehension = decoding × language comprehension. This student has adequate listening comprehension (language comprehension is intact) but weak passage comprehension despite accurate single-word decoding. The issue is that his decoding fluency is likely slow or effortful, consuming cognitive resources and limiting comprehension of connected text. Language comprehension is not weak (listening comprehension is average). Oral language is adequate based on listening comprehension performance. Phonemic awareness is not the concern; this student can decode accurately.",,
4,4,PQ_ACA-07_4,ACA-07,Which of the five components of reading should be assessed FIRST when evaluating a student with suspected dyslexia?,Phonemic awareness and phonics (decoding),Reading fluency,Vocabulary,Reading comprehension,,,A,"Dyslexia is fundamentally a deficit in phonological processing (phonemic awareness and the ability to map sounds to letters—phonics). These components should be assessed first because deficits here are the core characteristic of dyslexia. Fluency problems often result from decoding difficulties, so assessing fluency second makes sense. Vocabulary and comprehension are typically less impaired in pure dyslexia, though they may be secondarily affected due to reduced reading practice. Assessment should proceed from foundational components to higher-level ones.",,
4,5,PQ_ACA-07_5,ACA-07,"A kindergarten teacher uses a systematic, explicit phonics program where letter sounds are introduced in a carefully sequenced order, with daily practice in sound-symbol correspondence and blending. This approach is grounded in which literacy principle?","Whole language philosophy, which emphasizes meaning-making over decoding",The alphabetic principle and structured literacy approach,Embedded phonics within authentic reading experiences,Balanced literacy without specific phonics scope and sequence,,,B,"Systematic, explicit phonics instruction directly reflects the alphabetic principle (understanding that letters represent sounds) and the structured literacy approach emphasizing sequential, explicit instruction in sound-symbol relationships. Whole language (Option A) emphasizes meaning and context over explicit phonics—the opposite of what's described. Embedded phonics (Option C) integrates phonics incidentally within reading; this program is explicit and sequential, not incidental. Balanced literacy (Option D) may include phonics but does not require a specific scope and sequence; this program has both explicit structure and sequence.",,
4,6,PQ_ACA-07_6,ACA-07,A third-grader accurately decodes words and reads fluently (110 words per minute at grade level) but frequently loses the main idea when reading multi-paragraph passages. Which reading intervention is most appropriate to target first?,Oral reading fluency practice with timed drills,Decoding and word attack skills training,"Reading comprehension strategies (e.g., summarization, main idea identification)",Vocabulary instruction for academic Tier 2 and Tier 3 words,,,C,"This student's decoding and fluency are adequate; the deficit is in comprehension. Reading comprehension strategies (summarization, identifying main ideas, making inferences) directly address the problem. Fluency drills are unnecessary since fluency is already at grade level. Decoding is not the issue. While vocabulary support could be beneficial, comprehension strategy instruction is the more direct intervention for the identified problem (comprehension deficits despite adequate fluency).",,
4,7,PQ_ACA-07_7,ACA-07,Which statement most accurately describes Tier 2 vocabulary words and their importance in school psychology assessment and intervention?,"Tier 2 words are rarely occurring, specialized academic or technical terms used in specific domains (e.g., ""photosynthesis,"" ""mitochondria"")","Tier 2 words are high-frequency, everyday words that appear in natural conversation (e.g., ""cat,"" ""run,"" ""happy"")","Tier 2 words are high-frequency academic words that appear across multiple content areas and require explicit instruction (e.g., ""analyze,"" ""summarize,"" ""compare"")",Tier 2 words develop automatically through listening and conversation without explicit teaching,,,C,"Tier 2 words (Beck's classification) are high-frequency academic/literary words that appear across multiple content domains and benefit from explicit instruction. These are critical for academic success. Tier 3 words (Option A) are specialized, low-frequency domain-specific terms. Tier 1 words (Option B) are everyday, high-frequency words that develop naturally. Tier 2 words do not develop automatically (Option D); they require explicit teaching, which is why they are a focus of reading intervention.",,
4,8,PQ_ACA-07_8,ACA-07,"A first-grade student confuses the sounds /b/ and /d/, says ""bood"" for ""good,"" and writes ""b"" when asked to write ""d."" Which component of literacy development is most directly affected?",Phonological awareness of syllable boundaries,Phonemic awareness and phonics (sound-symbol correspondence),Morphological awareness and word structure,Pragmatic language skills in conversation,,,B,"The student is confusing individual phonemes (/b/ vs /d/) and their corresponding letter symbols—a core phonemic awareness and phonics issue. This is not a phonological awareness problem (which involves broader sound patterns like syllables). Morphological awareness relates to meaningful units (roots, prefixes, suffixes), not sound confusion. Pragmatic language (social language use) is unrelated to this phoneme-grapheme confusion.",,
4,9,PQ_ACA-07_9,ACA-07,Which evidence-based reading program uses the Orton-Gillingham approach and is most appropriate for students with dyslexia?,Reading Recovery (primarily a fluency intervention),"Wilson Reading System (systematic, multisensory, structured literacy)",Guided Reading Groups (a classroom organization strategy),Shared Reading (a foundational approach for beginning readers),,,B,"The Wilson Reading System is explicitly grounded in the Orton-Gillingham approach, emphasizing systematic, multisensory, sequential phonics instruction for students with dyslexia. Reading Recovery (Option A) is primarily a fluency-based intervention for struggling first graders, not specifically designed for dyslexia. Guided Reading Groups (Option C) are a classroom organization method, not an evidence-based dyslexia intervention. Shared Reading (Option D) is a foundational approach, not specifically structured for dyslexia remediation.",,
