batch,question_number,question_id,skill_id,question_stem,A,B,C,D,E,F,correct_answer,explanation,audit_flag,changes_applied
5,11,PQ_ACA-09_11,ACA-09,"A student on long-term corticosteroid medication for a chronic respiratory condition shows increased irritability, mood instability, and behavioral dysregulation at school. Which is the most appropriate action?",Assume the behavior is intentional and apply behavioral consequences,Refer to psychiatry for mental health treatment of presumed new-onset psychiatric disorder,Communicate with the prescribing physician about medication side effects and coordinate behavioral support while medical management is optimized,Ignore the behavior change and assume it will resolve spontaneously,,,C,"Corticosteroids commonly produce mood and behavioral side effects. The school psychologist should communicate medication side effects to the physician and provide behavioral support during medical optimization, rather than attributing behavior solely to psychiatric illness or intentional misbehavior. Option A misattributes causation. Option B may be premature without addressing medication effects. Option D ignores the documented problem.",STILL_FLAGGED|margin=54,
5,12,PQ_ACA-09_12,ACA-09,Which statement accurately describes how visual impairment affects school psychological assessment and educational intervention?,Standard literacy assessment procedures are appropriate for students with visual impairments; accommodations are not needed,"Assessment must be modified (e.g., braille, large print, audio format)",Students with visual impairment should be placed in segregated special schools away from peers without visual impairment,Visual impairment automatically results in intellectual disability,,,B,"Visual impairment requires significant assessment modifications (braille, large print, audio) and curriculum adaptations emphasizing alternative sensory modalities and orientation/mobility skills. Inclusion in general education (Option C) is appropriate with accommodations. Visual impairment does not cause intellectual disability (Option D). Standard assessment procedures (Option A) are not appropriate without modification.",,CORRECT_B_SHORTENED(semicolon trim)
5,13,PQ_ACA-09_13,ACA-09,A student with Tourette syndrome experiences frequent motor and vocal tics that intensify during stress and academic pressure. How should the school psychologist approach behavior management?,Use harsh consequences to suppress tic expression,Recognize that tics are involuntary,Assume tics are attention-seeking and ignore them,Recommend homebound instruction to eliminate exposure to academic stress,,,B,"Tics in Tourette syndrome are largely involuntary; punishment is ineffective and harmful. Stress reduction, classroom accommodations, and evidence-based tic reduction strategies (habit reversal training) are appropriate. Harsh consequences (Option A) increase stress and worsen tics. Ignoring tics (Option C) doesn't address functional impact. Homebound instruction (Option D) is unnecessary with appropriate accommodations.",,CORRECT_B_SHORTENED(semicolon trim)
5,14,PQ_ACA-09_14,ACA-09,Under which IDEA disability category should a student with severe asthma affecting attendance and classroom concentration most appropriately be considered for special education eligibility?,Specific Learning Disability,Other Health Impairment (OHI),Emotional Disturbance,Intellectual Disability,,,B,Asthma is explicitly listed as an example of OHI in IDEA regulations. A chronic health condition limiting educational functioning qualifies under OHI if it adversely affects educational performance. SLD (Option A) is a learning-specific category. ED (Option C) would require emotional/behavioral disturbance beyond the health effect. ID (Option D) is not indicated by asthma alone.,,
5,15,PQ_ACA-09_15,ACA-09,"A student taking methylphenidate (Ritalin) for ADHD reports decreased appetite and insomnia. The school psychologist notes these side effects are affecting academics (fatigue, difficulty concentrating). What is the most appropriate action?",Recommend the student stop the medication immediately without examining all available data or alternative explanations.,Communicate side effects to the prescribing physician for possible medication adjustment while providing school-based support and monitoring,Assume these are normal effects and make no changes without gathering data to support or refute that interpretation.,Increase stimulation and caffeine to counteract fatigue,,,B,"Decreased appetite and insomnia are documented stimulant side effects that legitimately impact functioning. The school psychologist should report these to the prescriber, who may adjust dosage, timing, or medication. Immediate discontinuation (Option A) is the physician's decision. Ignoring them (Option C) allows harm to continue. Increasing stimulation/caffeine (Option D) worsens insomnia.",,DISTRACTOR_A_EXPANDED; DISTRACTOR_C_EXPANDED
5,16,PQ_ACA-09_16,ACA-09,"A student with Type 1 diabetes and an IEP experiences a hypoglycemic episode (low blood sugar) resulting in confusion, irritability, and poor academic performance. Which statement best reflects appropriate school response?",Treat as a behavior problem and apply consequences for confusion and irritability,"Recognize hypoglycemia as a medical emergency, follow the student's diabetes care plan (blood glucose check, quick-acting carbohydrate).",Exclude the student from school until glucose is perfectly stable,Assign blame to the student or family for inadequate glucose management,,,B,"Hypoglycemia is a medical emergency causing cognitive and behavioral changes. The school nurse and trained staff follow the documented diabetes care plan (glucose monitoring, treatment). It is not a behavior problem (Option A) or cause for exclusion (Option C). Blame (Option D) is inappropriate and non-productive.",STILL_FLAGGED|margin=55,CORRECT_B_SHORTENED(monitor-clause trim)
5,17,PQ_ACA-09_17,ACA-09,A school psychologist is assessing a child with Prenatal Drug Exposure (PDE). Which neurodevelopmental domains are most commonly affected?,Only intellectual ability; other domains are unaffected,"Executive functioning, impulse control, social skills, and possibly intellectual functioning (depending on severity and drug type)","Only motor coordination; no cognitive effects, without adequate clinical justification.","Language only, which is not supported by the available evidence.",,,B,"Prenatal drug exposure can affect executive functioning, impulse control, social/emotional functioning, and potentially intellectual functioning. The specific profile depends on the drug, timing, and severity of exposure. Options A, C, and D incorrectly narrow the scope or misrepresent PDE effects.",,DISTRACTOR_C_EXPANDED; DISTRACTOR_D_EXPANDED
5,18,PQ_ACA-09_18,ACA-09,Which medication commonly used for seizure management can have the side effect of cognitive dulling or slowed processing speed?,Medications for blood pressure regulation only,"Some anticonvulsant medications (e.g., phenobarbital, some others)",Only antibiotic medications,No seizure medications have cognitive side effects,,,B,"Some anticonvulsant medications (particularly phenobarbital, but also others) can produce cognitive side effects including dulling, slowed processing, and drowsiness. A school psychologist should be aware of these effects and coordinate with the prescribing neurologist if cognitive impacts are significant. Options A, C, and D are inaccurate.",,
5,19,PQ_ACA-09_19,ACA-09,A student with ADHD has a 504 plan providing extended test time. Which is the primary educational rationale for this accommodation?,"To lower academic standards or grade content, without adequate clinical justification.","To compensate for reduced processing speed and working memory capacity, allowing adequate time for attention, executive functioning, and response formulation without penalizing ADHD effects on performance speed",To allow the student to avoid challenging material,"To guarantee better grades, which is not supported by the available evidence.",,,B,"Extended time for testing accommodates the executive functioning and processing demands of ADHD, allowing the student to demonstrate knowledge without penalty for attention/speed issues. This is a legitimate accommodation, not lowering standards (Option A), avoiding material (Option C), or guaranteeing grades (Option D).",PARTIAL_FIX|margin=124,DISTRACTOR_A_EXPANDED; DISTRACTOR_D_EXPANDED
5,20,PQ_ACA-09_20,ACA-09,A student returns to school following hospitalization for a severe illness. The student is medically cleared but is significantly deconditioned physically and reports anxiety about returning. Which school psychologist action best supports successful re-entry?,Place the student immediately in the regular schedule without accommodation,"Develop a gradual, phased re-entry plan",Recommend extended homebound instruction indefinitely,Assume anxiety is attention-seeking and ignore it,,,B,"Post-illness re-entry benefits from gradual re-entry planning, anxiety assessment and intervention, and medical/family coordination. Immediate full schedule (Option A) ignores reconditioning needs. Permanent homebound status (Option C) is unnecessary with planning. Dismissing anxiety (Option D) allows avoidance patterns to develop.

---",,CORRECT_B_SHORTENED(semicolon trim)
5,1,PQ_DEV-01_1,DEV-01,"According to Erikson's theory, a child in grades K-3 (approximately ages 5-8) is in which psychosocial stage, and what is the primary developmental task?",Trust vs Mistrust—learning to trust caregivers,Initiative vs Guilt—developing purpose and planning ability,Industry vs Inferiority—developing competence through mastery of skills and academic tasks,Identity vs Role Confusion—exploring self-concept and future roles,,,C,"School-age children (6-12 years) are in Erikson's Industry vs Inferiority stage, focused on developing competence, learning skills, and experiencing success in academic and social domains. Ages 3-5 are Initiative vs Guilt (Option B). Infancy is Trust vs Mistrust (Option A). Adolescence is Identity vs Role Confusion (Option D).",,
5,2,PQ_DEV-01_2,DEV-01,"A 5-year-old understands that a tall, thin glass and a short, wide glass contain the same amount of liquid only when he watches the pouring process. He cannot yet reliably answer conservation questions about rearranged objects. Which Piaget stage does this suggest?",Sensorimotor (0-2 years),Preoperational (2-7 years),Concrete Operational (7-11 years),Formal Operational (11+ years),,,B,"This child is in the Preoperational stage, characterized by lack of conservation—the inability to understand that quantity remains the same despite perceptual changes. He can understand conservation only with perceptual support (watching the pour), which is typical of this stage. Concrete Operational children (Option C) reliably conserve without perceptual support. Sensorimotor (Option A) and Formal Operational (Option D) are incorrect stages.",,
5,3,PQ_DEV-01_3,DEV-01,"According to Vygotsky's theory, the ""Zone of Proximal Development"" (ZPD) refers to:",Skills the child has already mastered independently,Tasks that are too difficult for the child to ever learn,The range between what a child can do independently and what he can do with adult scaffolding/support,The child's overall intelligence level,,,C,The ZPD is the gap between independent performance and performance with adult guidance—the area where learning occurs with support. Option A describes independent functioning (below the ZPD). Option B describes tasks beyond the ZPD. Option D misrepresents ZPD as an intelligence measure.,,
5,4,PQ_DEV-01_4,DEV-01,"A school psychologist implements scaffolding strategies (e.g., breaking tasks into steps, providing models, gradually reducing support) based on Vygotsky's theory. This practice reflects which key Vygotskian concept?",Object permanence,Scaffolding within the Zone of Proximal Development,Conservation,Theory of Mind,,,B,Scaffolding—providing graduated support that decreases as the child gains competence—is a direct application of Vygotsky's ZPD theory. Object permanence (Option A) and conservation (Option C) are Piagetian concepts. Theory of Mind (Option D) is a different developmental concept.,,
5,5,PQ_DEV-01_5,DEV-01,Bronfenbrenner's ecological systems model describes the child's environment in nested layers. Which system includes the interaction between the child's home and school?,Microsystem (immediate environments the child directly participates in),Mesosystem (connections between microsystems),Exosystem (indirect influences on the child),Macrosystem (cultural and societal values),,,B,"The Mesosystem consists of connections and interactions between microsystems (e.g., home-school communication, consistency between home and school expectations). The Microsystem (Option A) includes individual environments. The Exosystem (Option C) involves indirect influences (e.g., parent's workplace policies affecting family). The Macrosystem (Option D) is the broader cultural context.",,
5,6,PQ_DEV-01_6,DEV-01,"According to attachment theory (Bowlby, Ainsworth), an infant showing the ""secure attachment"" pattern would most likely exhibit which behavior when the parent returns after a brief separation?",Ignoring the parent and remaining engaged with toys,Showing fear and resistance; difficulty being comforted even when the parent returns,"Seeking proximity to the parent, being comforted, then returning to exploration",Showing confusion and disorganized behavior,,,C,"Secure attachment is characterized by the infant seeking the parent when distressed, being comforted, then resuming independent exploration. Ignoring (Option A) suggests avoidant attachment. Resistance and difficulty calming (Option B) suggest resistant/ambivalent attachment. Disorganized behavior (Option D) characterizes disorganized attachment.",,
5,7,PQ_DEV-01_7,DEV-01,"A toddler becomes extremely distressed when the parent leaves for work and refuses to be comforted by the teacher, even after 30 minutes. Later, the child cries when the parent returns and resists being picked up. This attachment pattern is most consistent with:",Secure attachment,Avoidant attachment,Resistant (Ambivalent) attachment,Disorganized attachment,,,C,"Resistant/ambivalent attachment is characterized by distress at separation, difficulty being comforted by others, and resistance or mixed reactions to the parent's return. Secure attachment (Option A) involves ease of comforting. Avoidant attachment (Option B) involves ignoring the parent. Disorganized (Option D) involves confused/inconsistent behavior.",,
5,8,PQ_DEV-01_8,DEV-01,Which motor milestone represents the typical timing of independent walking in a typically developing child?,6-8 months,9-11 months,12-15 months,18-24 months,,,C,"Independent walking typically emerges around 12-15 months (often reported as ""walking by 12 months""). Six to eight months (Option A) is the period of cruising and early balance. Nine to eleven months (Option B) is independent standing. Eighteen to twenty-four months (Option D) is beyond the typical window.",,
5,9,PQ_DEV-01_9,DEV-01,"A 14-year-old demonstrates increased abstract thinking, ability to reason about hypothetical situations, and emerging idealism about social issues. Which Piaget stage does this reflect?",Concrete Operational (7-11 years),Formal Operational (11+ years),Sensorimotor (0-2 years),Preoperational (2-7 years),,,B,"The ability to think abstractly, reason hypothetically, and engage with idealistic concepts is characteristic of Formal Operational thinking (Piaget's final stage, typically emerging around ages 11-14). Concrete Operational children (Option A) think in concrete terms about present reality. Options C and D are earlier stages.",,
5,10,PQ_DEV-01_10,DEV-01,"In Erikson's Identity vs Role Confusion stage (adolescence, 12-18 years), the primary developmental task is:","Learning trust in relationships, without adequate clinical justification.","Developing a sense of competence and mastery, without adequate clinical justification.","Exploring self-identity and experimenting with different social roles, eventually achieving a coherent sense of identity",Achieving generativity and contributing to society,,,C,"Adolescents in Identity vs Role Confusion explore various identities, social roles, and belief systems to develop a coherent sense of self. Option A (Trust vs Mistrust) is infancy. Option B (Industry vs Inferiority) is school age. Option D (Generativity vs Stagnation) is adulthood.",,DISTRACTOR_A_EXPANDED; DISTRACTOR_B_EXPANDED
5,11,PQ_DEV-01_11,DEV-01,"According to Marcia's theory, an adolescent who has explored various identity options and committed to a clear sense of identity has achieved which identity status?",Identity Achievement,Moratorium,Foreclosure,Identity Diffusion,,,A,Identity Achievement (Marcia's framework) represents having explored options and committed to an identity—the most adaptive status. Moratorium (Option B) is active exploration without commitment. Foreclosure (Option C) is commitment without exploration. Identity Diffusion (Option D) is neither exploration nor commitment.,,
5,12,PQ_DEV-01_12,DEV-01,"A 7-year-old playing a game becomes upset when another child suggests changing the rules, insisting ""that's not how you play!"" This reflects which aspect of Piaget's Concrete Operational thinking?",Egocentrism and inability to decenter,Centration on one aspect of a situation,Rigidity in applying rules; difficulty with flexibility and perspective-taking,Magical thinking and animism,,,C,"While Concrete Operational children are less egocentric than Preoperational children, they show rigidity in rule application and difficulty flexibly adapting rules—a characteristic limitation of this stage. Egocentrism (Option A) is primarily Preoperational. Centration (Option B) is also Preoperational. Magical thinking (Option D) is Preoperational.",,
5,13,PQ_DEV-01_13,DEV-01,Which of the following motor milestones represents a significant developmental delay if not achieved by age 18 months?,Running and jumping with coordination,Pedaling a tricycle independently,Independent walking,Writing recognizable letters,,,C,Independent walking is expected by 12-15 months; failure to walk by 18 months is considered a significant delay. Running/jumping (Option A) and tricycle pedaling (Option B) develop after walking. Writing letters (Option D) is a later skill.,,
5,14,PQ_DEV-01_14,DEV-01,"The development of ""Theory of Mind"" (understanding that others have beliefs, desires, and intentions different from one's own) typically emerges by what age?",12-18 months,2-3 years,4-5 years,7-8 years,,,C,"Theory of Mind solidifies around ages 4-5 (as evidenced by ""false belief"" task performance). Younger children (<3-4 years) are more egocentric and struggle to understand others' different mental states. Options A and B represent earlier stages. Option D is later than the typical emergence.",,
5,15,PQ_DEV-01_15,DEV-01,"A preschooler believes that the sun ""hides"" at night and ""goes to sleep."" This reflects which Piaget characteristic of Preoperational thinking?",Conservation failure,Animism (attributing life and intentions to inanimate objects),Egocentrism,Irreversibility,,,B,Animism—attributing animate qualities and intentions to inanimate objects (the sun has purpose/sleep)—is a characteristic Preoperational thinking pattern. Conservation (Option A) relates to quantity. Egocentrism (Option C) relates to perspective-taking. Irreversibility (Option D) relates to inability to reverse operations.,,
5,16,PQ_DEV-01_16,DEV-01,During which developmental period is the prefrontal cortex (responsible for executive functioning and impulse control) still undergoing significant development?,Infancy (0-12 months),Early childhood (1-5 years),Middle childhood (6-11 years) and continuing through adolescence (up to early 20s),All development is complete by age 10,,,C,"The prefrontal cortex continues developing throughout childhood and adolescence, with significant development occurring during middle childhood and substantial refinement continuing through the late teens and into the early 20s. This explains developmental improvements in impulse control and planning. Options A, B, and D misrepresent the timeline.",,
5,17,PQ_DEV-01_17,DEV-01,Kohlberg's theory of moral development describes progression from self-focused reasoning (avoiding punishment) to principle-based reasoning. At which stage do children typically adhere to rules primarily to avoid punishment or gain rewards?,"Social contract orientation, which is not supported by the available evidence.",Pre-conventional level (Stages 1-2: Punishment/Obedience and Instrumental/Exchange orientation),"Post-conventional level, which is not supported by the available evidence.","Conventional level, which is not supported by the available evidence.",,,B,The Pre-conventional level (Stages 1-2) characterizes young children who follow rules to avoid punishment or gain rewards—self-interested reasoning. The Conventional level (Options A and D) involves conformity to social norms. The Post-conventional level (Option C) involves principle-based reasoning.,,DISTRACTOR_A_EXPANDED; DISTRACTOR_C_EXPANDED; DISTRACTOR_D_EXPANDED
5,18,PQ_DEV-01_18,DEV-01,"An adolescent experiences significant physical growth, hormonal changes, and mood fluctuation during puberty. Which system in Bronfenbrenner's model would include these biological changes and their interaction with environmental factors (e.g., peer acceptance, body image concerns)?","Microsystem only, which is not supported by the available evidence.","Mesosystem, which is not supported by the available evidence.",The interaction of biological development with the microsystem and mesosystem,"Macrosystem only, which is not supported by the available evidence.",,,C,"Bronfenbrenner's model includes the person's biological development interacting with environmental systems. Pubertal changes (biological) interact with peers, family, and school (microsystem) and the connections between these systems (mesosystem). Pubertal development cannot be isolated to just the microsystem (Option A), mesosystem (Option B), or macrosystem (Option D).",,DISTRACTOR_A_EXPANDED; DISTRACTOR_B_EXPANDED; DISTRACTOR_D_EXPANDED
5,19,PQ_DEV-01_19,DEV-01,Which statement accurately reflects typical language development milestones from birth to age 3?,First words emerge around 24 months; two-word combinations develop around 36 months,"Babbling (4-8 months), first words (~12 months), two-word combinations (~24 months), simple sentences (~36 months)",Language is fully developed by age 12 months,All children follow identical timelines with no individual variation,,,B,"This sequence (babbling, first words around 12 months, two-word combinations around 24 months, sentences around 36 months) represents typical language development. Option A delays these milestones incorrectly. Option C understates development beyond 12 months. Option D ignores normal individual variation.",,
5,20,PQ_DEV-01_20,DEV-01,"A school psychologist observes that a 10-year-old and a 16-year-old respond very differently to the same social conflict. The 10-year-old focuses on fairness (""She broke the rule!"") while the 16-year-old considers the other person's perspective and possible reasons (""Maybe she had a good reason""). This difference best reflects:","Intellectual disability in the younger child, without adequate clinical justification.","Developmental progression from Concrete Operational to Formal Operational thinking, with corresponding development in social perspective-taking","Personality differences unrelated to development, without adequate clinical justification.","Better instruction for the older child, without adequate clinical justification.",,,B,"This demonstrates typical cognitive development: Concrete Operational children (school age) focus on concrete rules and fairness; Formal Operational adolescents can consider abstract motivations and multiple perspectives. This is normal development, not disability (Option A), personality (Option C), or instruction difference alone (Option D).

---",PARTIAL_FIX|margin=53,DISTRACTOR_A_EXPANDED; DISTRACTOR_C_EXPANDED; DISTRACTOR_D_EXPANDED
5,1,PQ_MBH-02_1,MBH-02,A fifth-grader with social anxiety refuses to raise her hand in class and avoids presenting projects in front of peers. Which counseling intervention approach is most evidence-based for addressing this anxiety?,Psychodynamic therapy exploring unconscious conflicts from childhood,Cognitive-behavioral therapy (CBT) with exposure hierarchy to gradually increase participation and cognitive restructuring of anxious thoughts,Play therapy without structured intervention goals,Medication as the sole intervention without behavioral support,,,B,"CBT with graded exposure (starting with small, manageable exposures and gradually increasing difficulty) and cognitive restructuring (challenging anxious thoughts) is evidence-based for social anxiety. Psychodynamic therapy (Option A) lacks strong support for anxiety disorders in children. Play therapy alone (Option C) is not the primary evidence-based approach for school-age anxiety. Medication alone (Option D) without behavioral intervention is insufficient.",STILL_FLAGGED|margin=74,
