batch,question_number,question_id,skill_id,question_stem,A,B,C,D,E,F,correct_answer,explanation,audit_flag,changes_applied
5,1,PQ_ACA-08_1,ACA-08,"According to Barkley's model, ADHD is best conceptualized as a disorder of which executive functioning domain?",Long-term memory encoding and retrieval,Inhibitory control and self-regulation (response inhibition),Visual-spatial processing,Semantic knowledge organization,,,B,"Barkley's influential model proposes that ADHD is fundamentally a disorder of behavioral inhibition and self-regulation, which are executive functions. This inhibitory deficit cascades to affect working memory, motivation, and emotion regulation. Long-term memory (Option A) is generally intact in ADHD. Visual-spatial processing (Option C) and semantic knowledge (Option D) are not the core deficits in Barkley's model.",,
5,2,PQ_ACA-08_2,ACA-08,"A second-grader frequently loses his backpack, forgets homework assignments, and cannot organize materials on his desk. Which executive functioning component is most directly impaired?",Working memory (holding information in mind temporarily),Planning and organization skills,Cognitive flexibility (set-shifting),Inhibitory control (response inhibition),,,B,"Losing items, forgetting assignments, and poor desk organization all reflect planning and organization deficits. This student struggles with systematically arranging and tracking information. Working memory (Option A) is more about holding information during a task, not losing items. Cognitive flexibility (Option C) and inhibitory control (Option D) are not the primary issues here.",,
5,3,PQ_ACA-08_3,ACA-08,"A student starts a math assignment but abandons it to work on art, then switches to science before completing anything. He seems unable to persist with one task. Which executive functioning component is primarily affected?",Cognitive flexibility (ability to shift between mental sets or tasks),Planning and organization,Task persistence and sustained attention (behavioral control/inhibition of distractions),Working memory capacity,,,C,"While the student shifts between tasks, the core deficit is inability to inhibit the urge to switch away and persist with the initial task. This reflects poor sustained attention and behavioral inhibition rather than overly flexible cognition. Option A describes the behavior but not the underlying deficit. Planning (Option B) and working memory (Option D) are not the primary concerns.",,
5,4,PQ_ACA-08_4,ACA-08,The BRIEF-2 (Behavior Rating Inventory of Executive Function) measures which domains of executive functioning?,"Only working memory and processing speed, without adequate clinical justification.","Inhibition, flexibility, working memory, planning, organization, task initiation, and emotional control","Only academic skills and reading fluency, without adequate clinical justification.","Memory and language only, which is not supported by the available evidence.",,,B,"The BRIEF-2 is a comprehensive EF assessment measuring multiple EF domains including inhibition, cognitive flexibility, working memory, planning, organization, task initiation, and emotional control. Options A, C, and D represent incomplete or inaccurate descriptions of the BRIEF-2's scope.",,DISTRACTOR_A_EXPANDED; DISTRACTOR_C_EXPANDED; DISTRACTOR_D_EXPANDED
5,5,PQ_ACA-08_5,ACA-08,A student with average intelligence scores low on working memory assessments but performs adequately on long-term memory tasks. His difficulty remembering multi-step directions is most consistent with which profile?,Learning disability in reading,"Executive functioning deficit, specifically weak working memory",Intellectual disability,Hearing impairment,,,B,Working memory (holding and manipulating information temporarily) is distinct from long-term memory. Difficulty following multi-step directions is a classic working memory deficit sign. Average intelligence (Option C is incorrect). Reading disability (Option A) and hearing impairment (Option D) would manifest differently and are not indicated by this selective working memory/long-term memory discrepancy.,,
5,6,PQ_ACA-08_6,ACA-08,Which statement best describes the relationship between metacognition and executive functioning?,They are unrelated constructs; metacognition is about thinking while EF is about behavior,Metacognition (thinking about one's thinking) supports executive functioning by enabling self-monitoring and strategic adjustment,Executive functioning must be present before metacognition can develop,Metacognition is irrelevant for school psychology assessment,,,B,"Metacognition—awareness and reflection on one's own thinking processes—is intimately related to EF, particularly self-monitoring and planning. Metacognitive awareness enables students to notice when strategies aren't working and adjust. They are integrated, not separate (Option A). Metacognition is not irrelevant (Option D). EF and metacognition develop concurrently rather than sequentially (Option C).",,
5,7,PQ_ACA-08_7,ACA-08,"A third-grade teacher implements visual schedules, breaks tasks into smaller steps, and provides external reminders/checklists for assignments. These classroom strategies most directly support which executive functioning need?",Remediating low general intelligence,"Providing external scaffolding to compensate for weak planning, organization, and memory",Treating attention deficit disorder through behavioral medication,Improving reading fluency and phonics skills,,,B,"Visual schedules, task breakdown, and external reminders/checklists are classic external scaffolds that compensate for weak executive functioning (planning, organization, working memory). These are not intended to treat intelligence (Option A), medication (Option C), or reading skills (Option D), though they support students with EF weaknesses.",,
5,8,PQ_ACA-08_8,ACA-08,"Research on cognitive training programs (like ""brain training"" or computerized working memory training) for children with ADHD shows which finding?","These programs produce substantial, lasting improvements in ADHD symptoms and academic performance",Benefits are modest and often limited to the trained task; transfer to other domains is questionable,They are effective for ADHD but ineffective for other conditions,They should replace medication as the first-line intervention,,,B,"Meta-analyses show that computerized cognitive training produces small to modest improvements, often specific to the trained task, with limited transfer to untrained abilities or real-world functioning. Option A overstates effectiveness. Option C is too narrow. Option D contradicts evidence; medication remains the first-line treatment for ADHD.",,
5,9,PQ_ACA-08_9,ACA-08,"A 10-year-old with weak executive functioning benefits from a reward system that provides frequent, immediate feedback and rewards for task completion. This approach reflects which theoretical principle?",Mastery learning (students should perfect one skill before moving to the next),Contingency management and behavioral reinforcement principles,Pure cognitive training without behavioral components,"Unstructured, child-led learning",,,B,"Frequent, immediate rewards for task completion reflect applied behavioral analysis (ABA) contingency management principles. This is especially effective for students with EF deficits because it provides external structure and motivation. Mastery learning (Option A) is a different concept. Option C contradicts the use of reinforcement. Option D is opposite to the structured approach needed.",,
5,10,PQ_ACA-08_10,ACA-08,"Which of the following best describes ""cool"" versus ""hot"" executive functioning?","Cool EF is emotion-free, abstract problem-solving (e.g., sorting tasks)",Cool EF is fast and automatic; hot EF is slow and deliberate,Cool EF develops in infancy; hot EF develops only in adolescence,They are the same construct with different terminology,,,A,"Cool EF involves abstract, emotion-neutral tasks (like the Wisconsin Card Sorting Task); hot EF involves emotionally-laden, reward-based decision-making in real contexts. A student may perform well on cool EF tasks but struggle with hot EF (e.g., resisting temptation). Options B, C, and D are incorrect characterizations.",,CORRECT_A_SHORTENED(semicolon trim)
5,11,PQ_ACA-08_11,ACA-08,"A student shows strong performance on laboratory EF tasks (working memory, inhibition tests) but demonstrates poor self-regulation in the classroom (calling out, losing materials, not completing work). Which explanation is most plausible?","The laboratory tests are invalid, which does not apply in this clinical context.","Hot EF in real-world contexts requires additional factors (motivation, emotional regulation) beyond cool EF abilities",The student has a learning disability despite normal EF,Classroom observations are unreliable and should be ignored,,,B,"The discrepancy between cool EF (lab tasks) and hot EF (classroom) reflects the additional demands of real-world situations, which involve emotions, motivation, social pressure, and competing rewards. Hot EF is not reducible to cool EF abilities. Lab tests are valid (Option A). Learning disability (Option C) is not the issue. Classroom observations are valid (Option D).",,DISTRACTOR_A_EXPANDED
5,12,PQ_ACA-08_12,ACA-08,"During the preschool years, which executive functioning component shows the most dramatic developmental improvement?","Long-term memory, which triples in capacity","Inhibitory control, which develops significantly from ages 3-5","Processing speed, which approximately doubles",Crystallized intelligence,,,B,"Inhibitory control shows dramatic development during the preschool years (ages 3-5), as evidenced by tasks like the delay-of-gratification tasks. Long-term memory (Option A) and crystallized intelligence (Option D) are not EF domains. Processing speed (Option C) improves more gradually than inhibitory control.",,
5,13,PQ_ACA-08_13,ACA-08,"A student with significant EF deficits but average intelligence benefits from external supports (written reminders, structured environment). Which principle does this illustrate?",Remediation—direct training to improve the underlying EF deficit,Compensation—using external aids to bypass or work around the deficit,Exclusion—removing the student from situations requiring EF,Medication—prescribing stimulants to enhance EF,,,B,"External supports (reminders, structured environment) are compensatory strategies that work around the EF deficit rather than directly training EF skills. Remediation (Option A) would involve direct EF training. Exclusion (Option C) is not appropriate. Medication (Option D) is a separate intervention category.",,
5,14,PQ_ACA-08_14,ACA-08,Which aspect of executive functioning is most directly affected by sleep deprivation in children and adolescents?,Long-term memory encoding,Crystallized intelligence,Inhibitory control and emotional regulation,Reading fluency,,,C,"Sleep deprivation primarily impairs inhibitory control, emotional regulation, and impulse control—core EF processes. This leads to increased behavioral dysregulation in sleep-deprived students. Long-term memory (Option A), intelligence (Option B), and reading fluency (Option D) are less directly affected by acute sleep loss compared to EF.",,
5,15,PQ_ACA-08_15,ACA-08,"A student demonstrates difficulty with response inhibition (acting without thinking) but shows adequate planning and organization skills. Based on this profile, which intervention is most appropriate?",Intensive planning and organizational instruction,"Behavioral strategies targeting impulse control (e.g., self-talk, pause cues, response cost)",Abstract reasoning and IQ training,Reading comprehension interventions,,,B,"A selective inhibitory control deficit calls for behavioral interventions targeting impulse control—self-talk (""Stop and think""), visual cues to pause, and consequences for impulsive actions. Planning/organizational instruction (Option A) is unnecessary if those skills are adequate. Options C and D do not target the identified deficit.",,
5,16,PQ_ACA-08_16,ACA-08,"According to neurodevelopmental research, which brain region is primarily responsible for executive functioning in children and adolescents?",Hippocampus,Prefrontal cortex,Cerebellum,Amygdala,,,B,"The prefrontal cortex (PFC), particularly the dorsolateral prefrontal cortex, is the primary brain region supporting executive functioning. The PFC continues to develop throughout adolescence, which explains why EF improves with age. The hippocampus (Option A) supports memory, the cerebellum (Option C) coordinates motor function, and the amygdala (Option D) processes emotion.",,
5,17,PQ_ACA-08_17,ACA-08,A student can accurately complete a math problem step-by-step when an adult guides her through the process but forgets the steps when working independently. This profile is most consistent with:,Intellectual disability,Working memory deficit affecting independent task execution,Mathematical learning disability,Attention deficit disorder only,,,B,"The student can perform the task with external support (adult scaffolding) but cannot hold the steps in mind independently, indicating a working memory deficit. With scaffolding, working memory demand is reduced because the adult partially supports it. Intellectual disability (Option A) would affect performance even with support. Learning disability (Option C) would involve conceptual understanding issues. ADHD (Option D) could co-occur but doesn't fully explain this working memory-specific pattern.",,
5,18,PQ_ACA-08_18,ACA-08,Which of the following best describes the developmental trajectory of executive functioning across childhood and adolescence?,Executive functioning reaches adult-level capacity by age 8-9 and remains stable thereafter,Executive functioning continues to develop gradually from early childhood through early adulthood (into the 20s),Executive functioning deteriorates during adolescence due to hormonal changes,Executive functioning is fully present at birth and requires no developmental change,,,B,"Research consistently shows that EF (particularly inhibitory control, working memory, and cognitive flexibility) develops gradually from early childhood through the late adolescent/early adult years (into the 20s), with significant development during preschool and early elementary years and continued development through adolescence. Options A, C, and D misrepresent the developmental trajectory.",,
5,19,PQ_ACA-08_19,ACA-08,A school psychologist is recommending accommodations for a student with weak working memory. Which accommodation is most directly supported by research on working memory limitations?,"Longer test-taking time, which is not supported by the available evidence.",Breaking multi-step directions into single steps and providing written instructions,"Reducing reading demands, which is not supported by the available evidence.","Lowering grade-level standards, without adequate clinical justification.",,,B,"Breaking complex tasks into single steps and providing external, written support directly reduces working memory load by externalizing information that would otherwise need to be held in mind. This is compensatory scaffolding. Longer time (Option A) helps somewhat but doesn't address the core working memory load. Options C and D are unnecessary modifications.",,DISTRACTOR_A_EXPANDED; DISTRACTOR_C_EXPANDED; DISTRACTOR_D_EXPANDED
5,20,PQ_ACA-08_20,ACA-08,Which statement accurately reflects the relationship between executive functioning and academic performance across core subjects?,"Executive functioning affects only math performance, not reading or writing","Executive functioning (particularly planning, organization, and impulse control) significantly impacts performance across all academic areas",Executive functioning is unrelated to academics; intelligence is the only factor that matters,"Executive functioning only affects students with ADHD, not typically developing students",,,B,"EF affects all academic domains: reading (maintaining focus and comprehension strategies), math (following steps, checking work), and writing (planning, organizing, revising). Strong EF supports academic success across subjects. Options A, C, and D incorrectly minimize or narrow the scope of EF's academic impact.

---",,CORRECT_B_SHORTENED(em-dash trim)
5,1,PQ_ACA-09_1,ACA-09,A seventh-grader returns to school following a moderate traumatic brain injury (TBI) sustained in a motor vehicle accident 6 weeks ago. She is medically cleared for school but reports fatigue and difficulty concentrating. Which is the school psychologist's most appropriate initial role?,Assume she will return to baseline functioning and place her in regular classes without modifications,"Assess current cognitive functioning, develop a re-entry plan with gradual return to full schedule.",Immediately refer for special education evaluation without additional assessment,Recommend she repeat the grade due to time away from school,,,B,"Post-TBI, students often have a period of recovery with fatigue, concentration problems, and possible late-emerging symptoms. The school psychologist should assess current functioning, develop a re-entry plan with gradual return (potentially part-time initially), monitor ongoing recovery, and adjust as needed. Assuming immediate return to normal (Option A) ignores TBI recovery needs. Immediate special ed referral (Option C) is premature without assessment data. Grade retention (Option D) is not indicated; accommodations during recovery are more appropriate.",,CORRECT_B_SHORTENED(monitor-clause trim)
5,2,PQ_ACA-09_2,ACA-09,A student with Type 1 diabetes has an Individualized Education Program (IEP) under the OHI (Other Health Impairment) category. Which statement accurately reflects the appropriate role of the school psychologist and school health team?,Diabetes management is only the parent's responsibility; school should not be involved,"The school psychologist coordinates with the school nurse for blood glucose monitoring, medication/insulin administration, and educational accommodations related to diabetes effects on cognition and attendance",Students with diabetes should be excluded from physical education and field trips,Blood glucose monitoring and insulin administration should be delegated to any school staff member without specific training,,,B,"Students with diabetes benefit from school/family collaboration on glucose monitoring, medication administration (per school nurse protocols), and accommodations for fluctuating blood sugar effects on cognition, mood, and attention. The school psychologist contributes to the team approach. Option A ignores the school's legitimate role. Options C and D represent inappropriate exclusion and safety violations.",STILL_FLAGGED|margin=85,
5,3,PQ_ACA-09_3,ACA-09,A child is diagnosed with Fetal Alcohol Spectrum Disorder (FASD). Which educational profile is most commonly associated with FASD?,Severe intellectual disability and inability to attend school,Strong abstract reasoning with poor motor coordination,"Average to near-average intelligence with significant executive functioning, adaptive functioning, and behavioral dysregulation",Highly superior cognitive abilities with specific phobia,,,C,"FASD typically presents with average to near-average intelligence but widespread executive functioning deficits, poor adaptive skills, and behavioral/emotional dysregulation—a profile that often leads to underidentification because the IQ appears adequate. Severe intellectual disability (Option A) occurs in some but not all cases. Option B and D are not characteristic profiles.",STILL_FLAGGED|margin=66,
5,4,PQ_ACA-09_4,ACA-09,"A student with epilepsy experiences absence seizures (brief staring spells lasting 5-10 seconds, multiple times daily). How do these seizures typically affect classroom learning and behavior?",Absence seizures are completely benign and have no educational impact,They cause aggressive behavior and require immediate removal from class,Frequent absence seizures cause brief losses of attention/awareness that can accumulate and affect learning.,They only affect students with intellectual disability,,,C,"Absence seizures are brief periods of lost consciousness (staring, unresponsiveness) lasting seconds, often multiple times per day. Cumulatively, these disrupt attention, information processing, and learning, particularly during instruction. They are not benign (Option A), do not inherently cause aggression (Option B), and occur across intellectual levels (Option D).",,CORRECT_C_SHORTENED(especially-clause trim)
5,5,PQ_ACA-09_5,ACA-09,"A fourth-grader returns to school after completing chemotherapy for leukemia. Academically, she shows fatigue, difficulty concentrating, and slower processing speed. Teachers attribute this to laziness. Which term best describes this cognitive effect of cancer treatment?","""Chemo brain"" or ""cancer-related cognitive impairment""",Laziness and lack of motivation,Learning disability,Age-inappropriate emotional immaturity,,,A,"""Chemo brain"" or cancer-related cognitive impairment is a well-documented phenomenon—chemotherapy can affect attention, memory, executive functioning, and processing speed. This is not attributable to laziness (Option B), is not necessarily a learning disability (Option C), and is not an emotional/maturity issue (Option D). Recognition of this effect is crucial for appropriate accommodations.",,CORRECT_A_SHORTENED(em-dash trim)
5,6,PQ_ACA-09_6,ACA-09,"Which health condition, if present during critical periods of brain development, is most likely to result in intellectual disability as a secondary effect?",Asthma,Type 2 diabetes diagnosed in adolescence,Severe chronic infections or lead exposure in early childhood,Seasonal allergies,,,C,"Severe infections (e.g., meningitis, encephalitis) and lead exposure during early childhood brain development can result in neurodevelopmental damage, including intellectual disability. Asthma (Option A) and seasonal allergies (Option D) are not neurotoxic. Type 2 diabetes (Option B) diagnosed in adolescence occurs after critical brain development periods.",,
5,7,PQ_ACA-09_7,ACA-09,A 504 plan is most appropriate for a student with which health condition?,Only severe health conditions requiring extensive accommodations,Health conditions that substantially limit a major life activity but that may not warrant special education eligibility.,Conditions that automatically qualify a student for special education services,Mental health conditions only,,,B,"A 504 plan is appropriate for students whose health condition substantially limits a major life activity (as defined by the ADA), regardless of whether they qualify for special education. Examples include asthma affecting attendance, ADHD affecting concentration, or diabetes affecting glucose regulation. Option A is too narrow. Option C conflates 504 and IEP eligibility. Option D is too narrow.",,CORRECT_B_SHORTENED(parenthetical trim)
5,8,PQ_ACA-09_8,ACA-09,A student with chronic pain secondary to a medical condition shows school refusal and avoidance behaviors. Which intervention approach is most evidence-based?,Excusing the student from all school attendance until pain is resolved,"Cognitive-behavioral intervention addressing pain-related anxiety, graded exposure to school, and family reinforcement of attendance",Assuming pain is behavioral and increasing consequences for non-attendance,Referring only to medical providers without school-based intervention,,,B,"Even with legitimate chronic pain, avoidance and anxiety can develop, requiring cognitive-behavioral intervention alongside medical pain management. Graded exposure and family reinforcement support return to school. Excusing attendance (Option A) reinforces avoidance. Consequences alone (Option C) without addressing anxiety are counterproductive. School psychologists should coordinate with medical providers (Option B), not defer entirely (Option D).",STILL_FLAGGED|margin=58,
5,9,PQ_ACA-09_9,ACA-09,Which of the following is most accurate regarding the relationship between ADHD and educational outcomes?,ADHD has minimal impact on academic achievement if the student has average intelligence,ADHD significantly impacts academics even with average/above-average intelligence.,ADHD only affects students with learning disabilities,ADHD improves on its own by high school without intervention,,,B,"ADHD substantially impacts academic performance regardless of intelligence—difficulty with sustained attention, impulse control, organization, and task completion directly interfere with academic functioning even in bright students. Intelligence alone does not mitigate ADHD effects (Option A). ADHD co-occurs with learning disabilities in some but not all cases (Option C). ADHD typically persists without intervention (Option D).",,CORRECT_B_SHORTENED(parenthetical trim)
5,10,PQ_ACA-09_10,ACA-09,A student with sickle cell disease experiences frequent pain episodes that result in school absences and fatigue when attending. Which educational accommodation is most appropriate?,Exclude the student from physical education and sports entirely,Coordinate with medical team,Place automatically in special education,Assume the condition is psychiatric and refer for mental health treatment only,,,B,"Sickle cell disease causes legitimate medical crises and chronic pain requiring coordination between school and medical teams. Flexible attendance, rest opportunities, and 504 accommodations address the actual limitations. Complete exclusion (Option A) is inappropriate. Automatic special education placement (Option C) is not warranted unless educational performance is significantly impacted. The condition is medical, not primarily psychiatric (Option D).",,CORRECT_B_SHORTENED(semicolon trim)
